[
  {
    "id": "homebridge",
    "name": "Homebridge",
    "github_url": "https://github.com/homebridge/homebridge",
    "stars": 24152,
    "category": "自部署 & 家庭服务器",
    "tags": ["智能家居", "HomeKit", "物联网", "桥接"],
    "description_plain": "让小米、米家、摄像头等各种不支持 Apple HomeKit 的智能设备，都能在 iPhone 的「家庭」App 里统一控制，还能用 Siri 语音操控",
    "target_users": ["普通用户", "开发者"],
    "difficulty": 3,
    "quick_start": [
      "准备一台一直开机的电脑或树莓派，用 Docker 或官方镜像一键安装 Homebridge",
      "安装完后用浏览器打开管理页面，创建管理员账号",
      "在插件市场搜索你家的智能设备品牌（比如「小米」「米家」），点击安装对应插件",
      "按插件说明填入设备的账号密码或 IP 地址，Homebridge 会自动把设备桥接到 HomeKit",
      "打开 iPhone 上的「家庭」App，扫描管理页面显示的二维码，所有设备就出现在 Apple 家庭里了"
    ],
    "alternatives": ["Home Assistant", "Scrypted"],
    "has_web_ui": true,
    "has_desktop_app": false,
    "has_cli": true,
    "license": "Apache-2.0",
    "added_date": "2026-06-02"
  },
  {
    "id": "node-red",
    "name": "Node-RED",
    "github_url": "https://github.com/node-red/node-red",
    "stars": 20123,
    "category": "自部署 & 家庭服务器",
    "tags": ["流程自动化", "可视化编程", "IoT", "智能家居"],
    "description_plain": "像画流程图一样把智能家居、网站API、数据库这些连起来，创建「检测到有人开门→开灯→发通知」这类自动化规则，不用写代码，拖拽连线就行",
    "target_users": ["普通用户", "开发者"],
    "difficulty": 3,
    "quick_start": [
      "用 Docker 一行命令安装：docker run -p 1880:1880 nodered/node-red",
      "浏览器打开 http://你的服务器IP:1880，进入可视化编辑器",
      "左边是功能节点（如定时器、HTTP请求、MQTT），拖一个到画布上",
      "再拖一个目标节点（如发邮件、控制智能灯），用线把它们连起来",
      "点右上角「部署」按钮，自动化规则就开始运行了"
    ],
    "alternatives": ["n8n", "Home Assistant 自动化"],
    "has_web_ui": true,
    "has_desktop_app": false,
    "has_cli": true,
    "license": "Apache-2.0",
    "added_date": "2026-06-02"
  },
  {
    "id": "netdata",
    "name": "Netdata",
    "github_url": "https://github.com/netdata/netdata",
    "stars": 73876,
    "category": "自部署 & 家庭服务器",
    "tags": ["系统监控", "实时", "性能分析", "告警"],
    "description_plain": "给你的服务器装一个「健康监测手环」，实时看 CPU、内存、网络、磁盘的使用情况，出问题了自动发告警。界面超好看，装好就能用，不需要配置",
    "target_users": ["普通用户", "开发者"],
    "difficulty": 2,
    "quick_start": [
      "用 Docker 一行命令安装：docker run -d --name netdata --hostname $(hostname) -p 19999:19999 netdata/netdata",
      "浏览器打开 http://你的服务器IP:19999，立即可看到酷炫的实时监控仪表盘",
      "左侧菜单可查看 CPU 温度、内存占用、网络流量、磁盘读写等几百个指标",
      "在设置里配置告警通知（支持邮件、企业微信、钉钉），指标超过阈值自动通知你"
    ],
    "alternatives": ["Grafana + Prometheus", "Beszel"],
    "has_web_ui": true,
    "has_desktop_app": false,
    "has_cli": true,
    "license": "GPL-3.0",
    "added_date": "2026-06-02"
  },
  {
    "id": "prometheus",
    "name": "Prometheus",
    "github_url": "https://github.com/prometheus/prometheus",
    "stars": 57853,
    "category": "自部署 & 家庭服务器",
    "tags": ["监控", "指标采集", "告警", "时序数据库"],
    "description_plain": "专业级的监控系统，定时去检查你的服务器、网站、数据库是否正常运行，把各项指标存起来，配合 Grafana 画出漂亮的趋势图，是运维人员的标配",
    "target_users": ["开发者"],
    "difficulty": 4,
    "quick_start": [
      "用 Docker 或 docker-compose 安装 Prometheus + Grafana 组合",
      "编辑 prometheus.yml 配置文件，添加你要监控的目标地址（网站、服务器等）",
      "重启后打开 Grafana 页面，导入 Prometheus 数据源",
      "添加官方预置的仪表盘模板，一键生成系统监控大屏",
      "在 Alertmanager 中设置告警规则，出问题自动发通知"
    ],
    "alternatives": ["Netdata", "Datadog", "Zabbix"],
    "has_web_ui": true,
    "has_desktop_app": false,
    "has_cli": true,
    "license": "Apache-2.0",
    "added_date": "2026-06-02"
  },
  {
    "id": "beszel",
    "name": "Beszel",
    "github_url": "https://github.com/henrygd/beszel",
    "stars": 14320,
    "category": "自部署 & 家庭服务器",
    "tags": ["轻量监控", "服务器", "Docker", "简洁"],
    "description_plain": "一个极轻量的服务器监控工具，专门为个人和小团队设计。界面干净好看，资源占用极小（才 10MB 内存），装好就能看到所有服务器的 CPU、内存、磁盘、网络状态",
    "target_users": ["普通用户", "开发者"],
    "difficulty": 2,
    "quick_start": [
      "用 Docker Compose 一键启动 Beszel Hub 中心端",
      "在需要监控的每台服务器上运行 Beszel Agent 代理容器",
      "打开浏览器访问 Hub 页面，在管理后台添加你的 Agent 地址",
      "主页上就能看到所有服务器的实时状态，出问题自动变色告警"
    ],
    "alternatives": ["Netdata", "Grafana + Prometheus"],
    "has_web_ui": true,
    "has_desktop_app": false,
    "has_cli": false,
    "license": "MIT",
    "added_date": "2026-06-02"
  },
  {
    "id": "keepassxc",
    "name": "KeePassXC",
    "github_url": "https://github.com/keepassxreboot/keepassxc",
    "stars": 22456,
    "category": "安全 & 隐私",
    "tags": ["密码管理", "离线", "加密", "跨平台"],
    "description_plain": "一个完全离线的密码管理器，所有密码存在你的电脑上的一个加密文件里，不经过任何云端。支持浏览器自动填充，手机电脑都能用",
    "target_users": ["技术小白", "普通用户"],
    "difficulty": 1,
    "quick_start": [
      "去 keepassxc.org 下载安装包，双击安装",
      "点「新建数据库」，给你的密码库起个名字，设置一个主密码（这个密码一定要记牢!）",
      "点「+」手动添加第一个账号，填网站名、用户名和密码",
      "安装浏览器插件 KeePassXC-Browser，以后登录网站就能自动填充账号密码了"
    ],
    "alternatives": ["Bitwarden", "1Password", "KeePass"],
    "has_web_ui": false,
    "has_desktop_app": true,
    "has_cli": true,
    "license": "GPL-3.0",
    "added_date": "2026-06-02"
  },
  {
    "id": "passbolt",
    "name": "Passbolt",
    "github_url": "https://github.com/passbolt/passbolt_api",
    "stars": 5400,
    "category": "安全 & 隐私",
    "tags": ["密码管理", "团队协作", "安全", "自托管"],
    "description_plain": "适合团队使用的开源密码管理器，所有密码加密存储在你自己的服务器上。团队成员可以安全地共享密码，谁查看了哪个密码都有记录，公司管理密码的合规利器",
    "target_users": ["开发者"],
    "difficulty": 4,
    "quick_start": [
      "用 Docker 一键部署 Passbolt 到你自己的服务器",
      "打开网页完成安装向导，创建管理员账号，生成安全密钥对",
      "安装 Passbolt 浏览器插件，登录后就能在网页上管理所有团队密码",
      "在后台创建「用户组」，把不同的人加入不同组，精细控制谁能看哪些密码",
      "团队成员收到邀请邮件后注册账号，安装浏览器插件即可使用"
    ],
    "alternatives": ["Bitwarden", "Vaultwarden", "1Password"],
    "has_web_ui": true,
    "has_desktop_app": false,
    "has_cli": true,
    "license": "AGPL-3.0",
    "added_date": "2026-06-02"
  },
  {
    "id": "jellyfin",
    "name": "Jellyfin",
    "github_url": "https://github.com/jellyfin/jellyfin",
    "stars": 38052,
    "category": "创意 & 媒体处理",
    "tags": ["媒体服务器", "电影", "音乐", "直播TV"],
    "description_plain": "搭建属于你自己的「Netflix + Spotify」，把你电脑上的电影、电视剧、音乐、照片整理成一个漂亮的私人影音库。在任何设备上随时随地播放，完全免费，没有广告",
    "target_users": ["普通用户", "技术小白"],
    "difficulty": 3,
    "quick_start": [
      "用 Docker 一键安装 Jellyfin 服务器端",
      "浏览器打开 http://你的服务器IP:8096，完成初始化设置",
      "在设置里添加你的电影和音乐文件夹，Jellyfin 会自动识别片名、海报、演员信息",
      "在手机、平板、电视上下载 Jellyfin App，填入服务器地址登录"
    ],
    "alternatives": ["Plex", "Emby", "Kodi"],
    "has_web_ui": true,
    "has_desktop_app": true,
    "has_cli": false,
    "license": "GPL-2.0",
    "added_date": "2026-06-02"
  },
  {
    "id": "navidrome",
    "name": "Navidrome",
    "github_url": "https://github.com/navidrome/navidrome",
    "stars": 13848,
    "category": "创意 & 媒体处理",
    "tags": ["音乐服务器", "流媒体", "私人电台", "自托管"],
    "description_plain": "搭建你的私人音乐流媒体服务器，就像拥有自己的 Spotify。把音乐文件放到服务器上，任何设备都能在线听歌，支持按专辑、歌手、播放列表浏览",
    "target_users": ["普通用户", "开发者"],
    "difficulty": 2,
    "quick_start": [
      "用 Docker 一键安装 Navidrome",
      "浏览器打开 http://你的服务器IP:4533，创建管理员账号",
      "在设置里指定你的音乐文件夹路径，Navidrome 自动扫描并建立音乐库",
      "手机上安装兼容的客户端 App（如 play:Sub、Substreamer），填入服务器地址即可听歌"
    ],
    "alternatives": ["Jellyfin", "Plexamp", "Airsonic"],
    "has_web_ui": true,
    "has_desktop_app": false,
    "has_cli": false,
    "license": "GPL-3.0",
    "added_date": "2026-06-02"
  },
  {
    "id": "audiobookshelf",
    "name": "Audiobookshelf",
    "github_url": "https://github.com/advplyr/audiobookshelf",
    "stars": 8163,
    "category": "创意 & 媒体处理",
    "tags": ["有声书", "播客", "音频管理", "自托管"],
    "description_plain": "把你的有声书和播客整理成一个私人图书馆，手机 App 能记住你的播放进度，支持倍速播放、定时关闭。就像拥有自己的「喜马拉雅 + Audible」",
    "target_users": ["普通用户", "技术小白"],
    "difficulty": 3,
    "quick_start": [
      "用 Docker 一键安装 Audiobookshelf",
      "浏览器打开 http://你的服务器IP:13378，创建管理员账号",
      "添加你的有声书和播客文件夹，Audiobookshelf 会自动下载封面和元数据",
      "手机安装 Audiobookshelf App（iOS/安卓都有），填入服务器地址即可收听"
    ],
    "alternatives": ["Prologue", "Booksonic", "Plex"],
    "has_web_ui": true,
    "has_desktop_app": false,
    "has_cli": false,
    "license": "GPL-3.0",
    "added_date": "2026-06-02"
  },
  {
    "id": "logseq",
    "name": "Logseq",
    "github_url": "https://github.com/logseq/logseq",
    "stars": 35420,
    "category": "文件 & 知识管理",
    "tags": ["笔记", "知识图谱", "大纲", "双向链接"],
    "description_plain": "一个像「大脑神经网络」一样的笔记工具，用大纲的方式写笔记，笔记之间通过 [[双向链接]] 自动建立联系，形成一张知识网络图。所有数据存成普通文件，你用任何软件都能打开",
    "target_users": ["普通用户", "开发者"],
    "difficulty": 2,
    "quick_start": [
      "去 logseq.com 下载桌面版安装，或通过 Docker 部署网页版",
      "打开后选择一个文件夹作为你的笔记仓库（可以选同步盘里的文件夹，多设备自动同步）",
      "在日记页面开始写东西，用 [[ 双括号输入已有笔记标题就能创建链接",
      "点左下角的「图谱」可以看到所有笔记之间的网状关系图"
    ],
    "alternatives": ["Obsidian", "Roam Research", "Notion"],
    "has_web_ui": true,
    "has_desktop_app": true,
    "has_cli": false,
    "license": "AGPL-3.0",
    "added_date": "2026-06-02"
  },
  {
    "id": "siyuan",
    "name": "SiYuan",
    "github_url": "https://github.com/siyuan-note/siyuan",
    "stars": 26912,
    "category": "文件 & 知识管理",
    "tags": ["笔记", "知识管理", "双向链接", "Markdown"],
    "description_plain": "思源笔记，国产开源笔记软件的天花板。支持块级引用、双向链接、文档树、思维导图，界面超级好看，数据完全由你掌控。对中文用户特别友好，本地优先设计",
    "target_users": ["普通用户", "技术小白", "开发者"],
    "difficulty": 2,
    "quick_start": [
      "去 b3log.org/siyuan 下载桌面版安装包，双击安装",
      "打开后创建一个工作空间文件夹（选你电脑上的一个文件夹就行）",
      "在左侧文档树新建一篇笔记，用 Markdown 语法写内容，所见即所得",
      "输入 (( 可以引用任何内容块，输入 [[ 链接到其他笔记，形成知识网络"
    ],
    "alternatives": ["Obsidian", "Logseq", "Notion"],
    "has_web_ui": true,
    "has_desktop_app": true,
    "has_cli": false,
    "license": "AGPL-3.0",
    "added_date": "2026-06-02"
  },
  {
    "id": "outline",
    "name": "Outline",
    "github_url": "https://github.com/outline/outline",
    "stars": 29257,
    "category": "文件 & 知识管理",
    "tags": ["团队文档", "Wiki", "知识库", "协作"],
    "description_plain": "团队知识库的最佳选择，界面比 Notion 还干净漂亮。支持实时协作编辑、全文搜索、Markdown，权限控制细致，非常适合团队沉淀文档和知识",
    "target_users": ["普通用户", "开发者"],
    "difficulty": 4,
    "quick_start": [
      "用 Docker Compose 部署 Outline（需要配合 OAuth 登录，推荐用 GitHub 或 Google 账号）",
      "打开网页后登录，创建第一个「集合」作为团队知识库",
      "在集合里新建文档，支持 Markdown 编辑、@提及其他成员、插入图片和文件",
      "左侧文档树可拖拽排序、嵌套子页面，打造清晰的团队知识体系"
    ],